{
  "$schema": "subproject_registry.schema.json",
  "version": "1.0.0",
  "baseline": {
    "monorepo": "4eaa5bffdff2598d22d8edae9ed19c6199bb0686",
    "website": "ebc836ad2dccfc357d57d4504a00bc4dd75a07bb"
  },
  "subprojects": {
    "source_indexer": {
      "name": "Source Indexer",
      "kind": "code",
      "category": "academic-hub",
      "lifecycle": "active",
      "package": "core/indexer",
      "code_paths": [
        "ai-sandbox/academic-rag-model/core/indexer"
      ],
      "readme_path": "ai-sandbox/academic-rag-model/core/indexer/README.md",
      "readme_absence_reason": null,
      "status_docs": [
        {
          "path": "ai-sandbox/academic-rag-model/docs/status/indexer/2026-08-29-source-indexer-status.md",
          "role": "current",
          "lifecycle_ids": [
            "source-indexer-core"
          ]
        },
        {
          "path": "ai-sandbox/academic-rag-model/docs/status/indexer/2026-08-29-passage-embeddings-status.md",
          "role": "current",
          "lifecycle_ids": [
            "passage-embeddings"
          ]
        },
        {
          "path": "ai-sandbox/academic-rag-model/docs/status/indexer/2026-10-03-cross-offering-linkage-status.md",
          "role": "current",
          "lifecycle_ids": [
            "cross-offering-linkage"
          ]
        }
      ],
      "status_absence_reason": null,
      "lifecycle_records": {
        "source-indexer-core": {
          "state": "current",
          "supersedes": [],
          "specs": [
            "ai-sandbox/academic-rag-model/docs/superpowers/specs/indexer/2026-08-27-source-indexer-design.md"
          ],
          "implementation_plans": [
            "ai-sandbox/academic-rag-model/docs/superpowers/plans/indexer/2026-08-28-source-indexer-core.md",
            "ai-sandbox/academic-rag-model/docs/superpowers/plans/indexer/2026-08-28-source-indexer-retag.md"
          ],
          "test_paths": [
            "ai-sandbox/academic-rag-model/tests/core/indexer/test_index_card.py",
            "ai-sandbox/academic-rag-model/tests/core/indexer/test_index_search.py"
          ],
          "absence_reasons": {
            "specs": null,
            "implementation_plans": null,
            "test_paths": null
          }
        },
        "passage-embeddings": {
          "state": "current",
          "supersedes": [],
          "specs": [
            "ai-sandbox/academic-rag-model/docs/superpowers/specs/indexer/2026-08-29-passage-embeddings-design.md"
          ],
          "implementation_plans": [
            "ai-sandbox/academic-rag-model/docs/superpowers/plans/indexer/2026-08-29-passage-embeddings.md"
          ],
          "test_paths": [
            "ai-sandbox/academic-rag-model/tests/core/indexer/test_chunk_index.py"
          ],
          "absence_reasons": {
            "specs": null,
            "implementation_plans": null,
            "test_paths": null
          }
        },
        "cross-offering-linkage": {
          "state": "current",
          "supersedes": [],
          "specs": [
            "ai-sandbox/academic-rag-model/docs/superpowers/specs/indexer/2026-10-03-cross-offering-linkage-design.md"
          ],
          "implementation_plans": [
            "ai-sandbox/academic-rag-model/docs/superpowers/plans/indexer/2026-10-03-cross-offering-linkage.md"
          ],
          "test_paths": [
            "ai-sandbox/academic-rag-model/tests/core/indexer/test_offering_links.py"
          ],
          "absence_reasons": {
            "specs": null,
            "implementation_plans": null,
            "test_paths": null
          }
        },
        "duplicate-detection": {
          "state": "current",
          "supersedes": [],
          "specs": [
            "ai-sandbox/academic-rag-model/docs/superpowers/specs/indexer/2026-09-17-cross-course-duplicate-textbook-detection-design.md"
          ],
          "implementation_plans": [
            "ai-sandbox/academic-rag-model/docs/superpowers/plans/indexer/2026-09-17-cross-course-duplicate-textbook-detection.md",
            "ai-sandbox/academic-rag-model/docs/superpowers/plans/indexer/2026-09-20-duplicate-auto-resolution.md"
          ],
          "test_paths": [
            "ai-sandbox/academic-rag-model/tests/core/indexer/test_duplicate_check.py"
          ],
          "absence_reasons": {
            "specs": null,
            "implementation_plans": null,
            "test_paths": null
          }
        },
        "subset-note-linking": {
          "state": "proposed",
          "supersedes": [],
          "specs": [
            "ai-sandbox/academic-rag-model/docs/superpowers/specs/indexer/2026-10-03-subset-note-linking-design.md"
          ],
          "implementation_plans": [
            "ai-sandbox/academic-rag-model/docs/superpowers/plans/indexer/2026-10-03-subset-note-linking.md"
          ],
          "test_paths": [
            "ai-sandbox/academic-rag-model/tests/core/indexer/test_offering_links.py"
          ],
          "absence_reasons": {
            "specs": null,
            "implementation_plans": null,
            "test_paths": null
          }
        }
      },
      "website": {
        "policy": "required",
        "page": "content/projects/academic-hub/source_indexer/index.md",
        "reason": null
      },
      "members": [],
      "archive_reason": null
    },
    "transcribe_notes": {
      "name": "Notes Transcription",
      "kind": "code",
      "category": "academic-hub",
      "lifecycle": "active",
      "package": "pipelines/transcribe_notes",
      "code_paths": [
        "ai-sandbox/academic-rag-model/pipelines/transcribe_notes"
      ],
      "readme_path": "ai-sandbox/academic-rag-model/pipelines/transcribe_notes/README.md",
      "readme_absence_reason": null,
      "status_docs": [
        {
          "path": "ai-sandbox/academic-rag-model/docs/status/transcribe_notes/2026-08-24-notes-transcription-status.md",
          "role": "current",
          "lifecycle_ids": [
            "notes-transcription"
          ]
        }
      ],
      "status_absence_reason": null,
      "lifecycle_records": {
        "notes-transcription": {
          "state": "current",
          "supersedes": [],
          "specs": [],
          "implementation_plans": [],
          "test_paths": [
            "ai-sandbox/academic-rag-model/tests/pipelines/transcribe_notes/test_transcribe_notes.py"
          ],
          "absence_reasons": {
            "specs": "No standalone design spec is established for this operational baseline.",
            "implementation_plans": "No standalone implementation plan is established for this operational baseline.",
            "test_paths": null
          }
        },
        "excalidraw-transcription": {
          "state": "current",
          "supersedes": [],
          "specs": [
            "ai-sandbox/academic-rag-model/docs/superpowers/specs/transcribe_notes/2026-09-09-excalidraw-notes-transcription-design.md"
          ],
          "implementation_plans": [
            "ai-sandbox/academic-rag-model/docs/superpowers/plans/transcribe_notes/2026-09-09-excalidraw-notes-transcription.md"
          ],
          "test_paths": [
            "ai-sandbox/academic-rag-model/tests/pipelines/transcribe_notes/test_transcribe_excalidraw.py"
          ],
          "absence_reasons": {
            "specs": null,
            "implementation_plans": null,
            "test_paths": null
          }
        },
        "subset-discovery": {
          "state": "current",
          "supersedes": [],
          "specs": [
            "ai-sandbox/academic-rag-model/docs/superpowers/specs/transcribe_notes/2026-10-03-notes-subset-discovery-design.md"
          ],
          "implementation_plans": [
            "ai-sandbox/academic-rag-model/docs/superpowers/plans/transcribe_notes/2026-10-03-notes-subset-discovery.md"
          ],
          "test_paths": [
            "ai-sandbox/academic-rag-model/tests/pipelines/transcribe_notes/test_agent_work_discovery_exclusion.py"
          ],
          "absence_reasons": {
            "specs": null,
            "implementation_plans": null,
            "test_paths": null
          }
        },
        "agent-driven-transcription": {
          "state": "proposed",
          "supersedes": [],
          "specs": [
            "ai-sandbox/academic-rag-model/docs/superpowers/specs/transcribe_notes/2026-10-09-agent-driven-transcription-design.md"
          ],
          "implementation_plans": [
            "ai-sandbox/academic-rag-model/docs/superpowers/plans/2026-10-09-agent-driven-transcription-plan.md"
          ],
          "test_paths": [
            "ai-sandbox/academic-rag-model/tests/pipelines/transcribe_notes/test_agent_driver.py"
          ],
          "absence_reasons": {
            "specs": null,
            "implementation_plans": null,
            "test_paths": null
          }
        }
      },
      "website": {
        "policy": "required",
        "page": "content/projects/academic-hub/notes_transcription/index.md",
        "reason": null
      },
      "members": [],
      "archive_reason": null
    },
    "convert_textbook": {
      "name": "Textbook Conversion",
      "kind": "code",
      "category": "academic-hub",
      "lifecycle": "active",
      "package": "pipelines/convert_textbook",
      "code_paths": [
        "ai-sandbox/academic-rag-model/pipelines/convert_textbook"
      ],
      "readme_path": "ai-sandbox/academic-rag-model/pipelines/convert_textbook/README.md",
      "readme_absence_reason": null,
      "status_docs": [
        {
          "path": "ai-sandbox/academic-rag-model/docs/status/convert_textbook/2026-09-10-textbook-conversion-status.md",
          "role": "current",
          "lifecycle_ids": [
            "textbook-conversion"
          ]
        },
        {
          "path": "ai-sandbox/academic-rag-model/docs/status/convert_textbook/2026-08-22-chapter-aware-chunking-status.md",
          "role": "current",